vacancy_id,vacancy_name,role_group,employer_name,area,experience,schedule,salary_from,salary_to,salary_currency,hard_skills,soft_skills,tools,vacancy_url
134718162,Business Development Assistant (Operations &amp; Technology),BDM,EnterExpert LLC,Ташкент,От 1 года до 3 лет,"На месте работодателя, Удалённо, Гибрид",1750.0,2100.0,USD,business development,планирование,"excel, microsoft office, outlook, word",https://hh.ru/vacancy/134718162
134718115,Sales manager / Менеджер по продажам,Sales (общее),Дворник Тимофей Игоревич,Москва,Нет опыта,Удалённо,,,RUB,"b2b sales, b2b продажи, business development, активные продажи, воронка продаж, выявление потребностей, заключение договоров, коммерческое предложение, кросс-продажи, лидогенерация, презентации","аккуратность, внимательность, внимательность к деталям, деловое общение, контроль, обратная связь, ответственность, переговоры, самостоятельность, сервис, телефонные переговоры",telegram,https://hh.ru/vacancy/134718115
134826964,Scout / Business Development Manager LatAm (Poker / iGaming),BDM,Jobski,Колумбия,От 1 года до 3 лет,Удалённо,,,RUB,"business development, lead generation, pipeline",,,https://hh.ru/vacancy/134826964
134807165,Менеджер по развитию бизнеса / Senior BizDev Manager (Performance Marketing),BDM,Эдстрим Диджитал,Москва,От 3 до 6 лет,"Удалённо, Гибрид",350000.0,,RUB,"b2b продажи, business development, командировки, тендеры","мотивация, сервис",,https://hh.ru/vacancy/134807165
134808585,Business Development manager / Менеджер по работе с партнерами,BDM,DatsTeam,Москва,От 1 года до 3 лет,Удалённо,,,RUB,"business development, ведение переговоров, индивидуальный подход, переговоры, проведение переговоров","взаимодействие, деловая переписка, командная работа, контроль, мотивация, развитие",,https://hh.ru/vacancy/134808585
134785250,"Менеджер по развитию бизнеса BizDev - Международный проект, (Английский обязательно)",BDM,Важно знать,Москва,Нет опыта,Удалённо,,,RUB,"b2b продажи, outbound, saas, воронка продаж, малый и средний бизнес, полный цикл продаж","взаимодействие, инициативность, принятие решений, самостоятельность",,https://hh.ru/vacancy/134785250
134831824,Sales Manager (SMB) / Менеджер по продажам (СМБ),Sales (общее),Aviasales.ru,Москва,От 3 до 6 лет,"На месте работодателя, Удалённо, Гибрид",,270000.0,RUB,"b2b продажи, business development, активные продажи, билеты, план продаж, холодные продажи",переговоры,,https://hh.ru/vacancy/134831824
133927971,Менеджер по работе с партнерами/Business development manager,BDM,Topface Media,Москва,От 1 года до 3 лет,"Удалённо, Гибрид, Разъездной",150000.0,,RUB,"активные продажи, мониторинг, проведение переговоров","взаимодействие, деловая переписка, нетворкинг, переговоры, развитие",,https://hh.ru/vacancy/133927971
134709987,Affiliate Manager / Partner Sales Manager (AI Companion / AI Girlfriend),Sales (общее),Болдырева Анастасия Максимовна,Кипр,От 1 года до 3 лет,Удалённо,3000.0,,USD,"business development, переговоры, цикл сделки","активность, деловое общение, мотивация",,https://hh.ru/vacancy/134709987
134766991,Business Development Manager/Глава СТМ (Fresh Food / Ready Meals/Retail),BDM,Вefit,Москва,От 3 до 6 лет,Удалённо,,,RUB,"командировки, презентации, проведение переговоров, упаковка","взаимодействие, обратная связь, переговоры, принятие решений, развитие, руководство, самостоятельность, сервис",,https://hh.ru/vacancy/134766991
134658296,Business Development Manager,BDM,Hunter Technology,Кипр,От 1 года до 3 лет,Удалённо,,,RUB,"business development, заключение сделок, коммерческое предложение, мониторинг, презентации, развитие бизнеса","инициативность, переговоры, проактивность, развитие",,https://hh.ru/vacancy/134658296
134654983,Business Development Manager (FX/CFD),BDM,Offer Now,Кипр,От 3 до 6 лет,"Удалённо, Гибрид",,6000.0,EUR,ведение клиентов,"нацеленность на результат, профессиональный рост",,https://hh.ru/vacancy/134654983
134846950,Business Development Manager / Менеджер по развитию Igaming,BDM,CRTEX,Москва,От 1 года до 3 лет,"Удалённо, Гибрид",,,RUB,"business development, заключение контрактов, коммерческое предложение, развитие бизнеса","ориентация на результат, ответственность, переговоры, принятие решений, профессиональный рост, развитие",,https://hh.ru/vacancy/134846950
134842022,Business Development Manager,BDM,kraff.ru,Москва,От 1 года до 3 лет,Удалённо,,,RUB,"business development, средний чек","нетворкинг, сервис",,https://hh.ru/vacancy/134842022
134632681,Business Development Manager (High-Risk / iGaming),BDM,Дорошенко Софья Дмитриевна,Москва,От 1 года до 3 лет,Удалённо,150000.0,,RUB,"business development, комплаенс, лицензирование","переговоры, планирование, развитие",,https://hh.ru/vacancy/134632681
134470566,Менеджер по развитию бизнеса / Senior B2B Sales Manager,BDM,Лифтуум,Москва,От 3 до 6 лет,Удалённо,200000.0,350000.0,RUB,"воронка продаж, выполнение плана, коммерческое предложение, отели, отчётность, план продаж, холодные звонки","переговоры, принятие решений, развитие, руководство, сервис",,https://hh.ru/vacancy/134470566
131819656,Business Development Manager (Senior Sales Manager),BDM,Бизнес Трэвел Джоб,Москва,От 3 до 6 лет,"Удалённо, Гибрид",150000.0,250000.0,RUB,"b2b продажи, business development, saas, активные продажи, аудит, заключение договоров, информационная безопасность, командировки, корпоративные продажи, развитие бизнеса, сертификация, холодные продажи","аналитическое мышление, переговоры, презентации, развитие, руководство",,https://hh.ru/vacancy/131819656
134473490,Business Development Manager,BDM,ONMYADS,Минск,От 3 до 6 лет,Удалённо,1250.0,,USD,"b2b продажи, business development, saas, активные продажи, воронка продаж, выполнение плана, отчётность, проведение переговоров, развитие бизнеса, холодные продажи, цикл сделки","взаимодействие, деловая переписка, переговоры, презентации, принятие решений, развитие",telegram,https://hh.ru/vacancy/134473490
134134722,"Sales Manager (B2B SaaS, FinTech)",Enterprise/SaaS Sales,Combo Cards,Москва,От 3 до 6 лет,Удалённо,3000.0,6000.0,USD,"business development, go, outbound, saas, выполнение плана, инвойс, контроль дебиторки, корпоративные продажи, презентации, работа с ключевыми клиентами, сверки, цикл сделки","контроль, ориентация на результат, переговоры, планирование, развитие, самостоятельность, сервис",telegram,https://hh.ru/vacancy/134134722
134846961,Business Development Manager,BDM,Бонакер Александр Александрович,Москва,От 3 до 6 лет,Удалённо,,,RUB,"business development, активные продажи, заключение договоров, отчётность, переговоры, работа с ключевыми клиентами","активность, креативность, презентации, принятие решений, развитие, управление командой",,https://hh.ru/vacancy/134846961
134799873,Специалист по развитию B2B-коммуникаций / Международные поставки и ВЭД,BDM,Апрель,Москва,От 1 года до 3 лет,Удалённо,120000.0,250000.0,RUB,"business development, ведение переговоров, вэд, развитие бизнеса, сертификация, сопровождение клиентов, таможенное оформление","взаимодействие, деловое общение, нетворкинг, переговоры, презентации, работа с клиентами, развитие, телефонные переговоры",,https://hh.ru/vacancy/134799873
134614543,Partnership Manager,Прочее,ЧАСТНАЯ КОМПАНИЯ COLLECT&amp;PAY LTD.,Кипр,От 1 года до 3 лет,"На месте работодателя, Удалённо",,,RUB,"b2b продажи, lead generation, pipeline, saas","активность, ориентация на результат",,https://hh.ru/vacancy/134614543
134768190,"Business Development manager (IT, fintech, B2B)",BDM,АпТрейдер (UpTrader),Санкт-Петербург,От 1 года до 3 лет,Удалённо,,,RUB,"b2b продажи, saas, выявление потребностей, презентация продукта, тёплые продажи, холодные продажи","нетворкинг, презентации",,https://hh.ru/vacancy/134768190
134739991,Sales Manager / Business Development Manager (iGaming),BDM,HR ME,Москва,От 1 года до 3 лет,Удалённо,,,RUB,"b2b продажи, business development, outbound, воронка продаж, командировки, коммерческое предложение, комплаенс, лидогенерация, презентация продукта, упаковка","нетворкинг, обратная связь, переговоры, презентации",sales navigator,https://hh.ru/vacancy/134739991
134746710,Country sales manager,Sales (общее),Хайер Мидл Эйжа,Бишкек,От 3 до 6 лет,Удалённо,,,RUB,,,"excel, powerpoint, word",https://hh.ru/vacancy/134746710
134148021,Business Development Manager (Affiliates &amp; Partnerships),BDM,ЧК XCHIEF CENTRAL ASIA LTD.,Алматы,От 3 до 6 лет,"На месте работодателя, Удалённо, Гибрид, Разъездной",1500.0,,USD,"business development, переговоры","внимательность, внимательность к деталям, коллаборация, контроль, развитие",,https://hh.ru/vacancy/134148021
134383977,Менеджер по развитию международного бизнеса (Business Development Manager),BDM,StableGrowz,Минск,От 1 года до 3 лет,Удалённо,800.0,,USD,"b2b продажи, business development, корпоративные продажи, отчётность, презентации, проведение переговоров, развитие бизнеса, холодные продажи, цикл сделки","грамотная речь, деловая переписка, деловое общение, организация, переговоры, профессиональный рост, развитие","linkedin sales navigator, sales navigator",https://hh.ru/vacancy/134383977
134064093,Sales Manager (В2С/B2B),Sales (общее),Губанова и Партнеры,Минск,От 1 года до 3 лет,Удалённо,2000.0,,USD,"inbound, outbound, активные продажи, холодные продажи",развитие,monday,https://hh.ru/vacancy/134064093
134122001,Chief of Staff основателя Tranio Capital,Прочее,Assisteca,Москва,Более 6 лет,Удалённо,350000.0,,RUB,"business development, claude, go, аудит, отели","аналитическое мышление, контроль, мотивация, развитие",,https://hh.ru/vacancy/134122001
134808705,Sales / Business Development Manager (iGaming B2B),BDM,Зенит-Брокер,Москва,От 3 до 6 лет,Удалённо,,,RUB,"b2b sales, pipeline, sales pipeline, переговоры, цикл сделки",самостоятельность,,https://hh.ru/vacancy/134808705
134269495,Sales Manager (Web3 / Crypto),Sales (общее),Motion Trade,Москва,От 1 года до 3 лет,Удалённо,3000.0,5000.0,USD,"b2b продажи, business development, pipeline, холодные продажи",,,https://hh.ru/vacancy/134269495
134660696,Менеджер по развитию бизнеса / Business Development Manager (PSP),BDM,HR ME,Москва,От 1 года до 3 лет,Удалённо,,,RUB,"business development, go, ведение переговоров, заключение договоров, мониторинг, переговоры, проведение переговоров","нетворкинг, ответственность, развитие",,https://hh.ru/vacancy/134660696
134434472,Event Manager (со знанием английского языка),Прочее,BGS Group,Тбилиси,Нет опыта,Удалённо,56000.0,110000.0,RUB,"визы, командировки, отели, подарки","контроль, наставничество, организация, ответственность, переговоры",,https://hh.ru/vacancy/134434472
131317747,Senior Project Manager,Прочее,Syberry CIS,Минск,Более 6 лет,"Удалённо, Гибрид",,,RUB,,,,https://hh.ru/vacancy/131317747
134788312,Senior Sales Manager (FinTech / Payment Solutions),Sales (общее),Spayz.io,Кипр,От 3 до 6 лет,Удалённо,,,RUB,"business development, ведение переговоров, полный цикл продаж, развитие бизнеса","ориентация на результат, переговоры, развитие, сервис",,https://hh.ru/vacancy/134788312
134413582,Business Development Manager — продажи IT-команд и разработчиков (Full-cycle / 360 Sales),BDM,Хайруллина Айгуль Исмагыловна,Москва,От 3 до 6 лет,Удалённо,,,RUB,"b2b продажи, business development, outbound, saas, активные продажи, воронка продаж, допродажи, коммерческое предложение, развитие клиентов, цикл сделки","деловая переписка, деловое общение, инициативность, мотивация, нетворкинг, переговоры, презентации, принятие решений, развитие, самостоятельность",,https://hh.ru/vacancy/134413582
133110216,Affiliate manager l Business development manager,BDM,To The Stars co LTD,Москва,От 1 года до 3 лет,Удалённо,,,RUB,"b2b продажи, ведение переговоров, заключение договоров, переговоры, работа с ключевыми клиентами","взаимодействие, деловая переписка, ориентация на результат, ответственность, профессиональный рост, развитие",,https://hh.ru/vacancy/133110216
134795358,Sales manager ASO (Менеджер по развитию бизнеса),BDM,Тулидс,Москва,От 1 года до 3 лет,"Удалённо, Гибрид",,,RUB,"upsell, коммерческое предложение, корпоративы, отчётность","гибкость, переговоры, развитие, самостоятельность, системное мышление",,https://hh.ru/vacancy/134795358
134757977,Program Manager,Прочее,GP Solutions,Минск,От 3 до 6 лет,"На месте работодателя, Удалённо, Гибрид",,,RUB,enterprise,,,https://hh.ru/vacancy/134757977
134809912,Senior Operations Coordinator,Прочее,Motheretreat INC,Колумбия,От 3 до 6 лет,Удалённо,1200.0,1500.0,USD,переговоры,"аналитическое мышление, развитие, управление временем",microsoft office,https://hh.ru/vacancy/134809912
134661262,Affiliate manager - AI companion / AI girlfriend,Прочее,Болдырева Анастасия Максимовна,Тбилиси,От 1 года до 3 лет,Удалённо,3000.0,,USD,business development,переговоры,,https://hh.ru/vacancy/134661262
134695126,Closer / Business Development Manager (B2B iGaming),BDM,HR ME,Сербия,От 3 до 6 лет,Удалённо,,,RUB,"b2b продажи, business development, enterprise, saas, коммерческое предложение, лицензирование, полный цикл продаж",переговоры,,https://hh.ru/vacancy/134695126
134805271,Delivery Manager,Прочее,Andersen,Сербия,Более 6 лет,Удалённо,,,RUB,"aws, business development, enterprise, microservices, pipeline, security, solid",,access,https://hh.ru/vacancy/134805271
134674268,Менеджер по развитию бизнеса (BDM/Business Development Manager),BDM,Фабрика десертов,Оренбург,От 3 до 6 лет,"На месте работодателя, Удалённо",100000.0,300000.0,RUB,"b2b продажи, ведение переговоров, заключение договоров, мониторинг, отчётность, план продаж, презентации, развитие бизнеса, холодные продажи","деловое общение, ответственность, переговоры, развитие, телефонные переговоры",,https://hh.ru/vacancy/134674268
134040117,P2P Business Development Manager,BDM,Selecty,Минск,От 3 до 6 лет,Удалённо,,,RUB,"account management, business development, ведение переговоров, заключение сделок, командировки, переговоры, презентации","организация, ориентация на результат, ответственность, публичные выступления, развитие, самостоятельность",,https://hh.ru/vacancy/134040117
134682353,Project Manager,Прочее,Magnetto.com,Тбилиси,От 1 года до 3 лет,Удалённо,,,RUB,solid,,"access, telegram",https://hh.ru/vacancy/134682353
133603360,Менеджер по продажам корпоративным клиентам,Sales (общее),Точка Банк,Тольятти,От 1 года до 3 лет,"Удалённо, Гибрид",100000.0,,RUB,"активные продажи, акты, выполнение плана","контроль, обратная связь, развитие, сервис",,https://hh.ru/vacancy/133603360
134526346,Менеджер по привлечению клиентов среднего бизнеса,Прочее,Точка Банк,Химки (Московская область),От 1 года до 3 лет,Удалённо,140000.0,,RUB,"активные продажи, акты, корпоративы, переговоры, холодные звонки","обратная связь, развитие, сервис",,https://hh.ru/vacancy/134526346
134496330,Менеджер активных продаж,Sales (общее),Точка Банк,Санкт-Петербург,От 1 года до 3 лет,"На месте работодателя, Удалённо, Гибрид",140000.0,,RUB,"активные продажи, акты, корпоративы, переговоры, холодные звонки","обратная связь, развитие, сервис",,https://hh.ru/vacancy/134496330
134757276,Менеджер по продажам (СЗФО),Sales (общее),Biglion,Санкт-Петербург,От 3 до 6 лет,Удалённо,150000.0,,RUB,"b2b продажи, активные продажи, подарки, развитие бизнеса, холодные звонки, холодные продажи","контроль, переговоры, развитие, самостоятельность, телефонные переговоры",,https://hh.ru/vacancy/134757276
132668317,Ведущий менеджер по продажам среднему и крупному бизнесу,Sales (общее),Т-Банк,Ярославль,От 1 года до 3 лет,"Удалённо, Разъездной",145000.0,,RUB,"баланс, вэд, коммерческое предложение, холодные звонки","взаимодействие, гибкость, переговоры, развитие",,https://hh.ru/vacancy/132668317
134757485,"Менеджер корпоративных продаж (услуги,ЮФО)",Sales (общее),Biglion,Краснодар,От 1 года до 3 лет,Удалённо,120000.0,,RUB,"b2b продажи, активные продажи, подарки, развитие бизнеса, холодные звонки, холодные продажи","контроль, переговоры, развитие, самостоятельность, телефонные переговоры",,https://hh.ru/vacancy/134757485
134808534,Ведущий менеджер по продажам,Sales (общее),Zoon.ru,Санкт-Петербург,От 1 года до 3 лет,Удалённо,150000.0,,RUB,"b2b продажи, активные продажи, заключение договоров, корпоративы, малый и средний бизнес, план продаж, презентации, средний чек, холодные звонки, холодные продажи","организация, переговоры, развитие, сервис, телефонные переговоры",,https://hh.ru/vacancy/134808534
134693135,Начинающий менеджер по продажам,Sales (общее),Точка Банк,Москва,Нет опыта,"На месте работодателя, Удалённо, Гибрид",100000.0,,RUB,"b2b продажи, активные продажи, выполнение плана, выявление потребностей, корпоративы, план продаж","деловая переписка, переговоры, развитие, сервис, телефонные переговоры",,https://hh.ru/vacancy/134693135
134847032,Менеджер по продажам B2B (home-office),Sales (общее),VICTORY group,Казань,От 1 года до 3 лет,Удалённо,120000.0,200000.0,RUB,"b2b продажи, активные продажи, заключение договоров, план продаж, презентации, презентация продукта, работа с возражениями","деловое общение, инициативность, многозадачность, нацеленность на результат, ответственность, переговоры, развитие, телефонные переговоры",,https://hh.ru/vacancy/134847032
134756676,Менеджер корпоративных продаж (Урал),Sales (общее),Biglion,Екатеринбург,От 3 до 6 лет,Удалённо,120000.0,,RUB,"b2b продажи, активные продажи, подарки, развитие бизнеса, холодные звонки, холодные продажи","контроль, переговоры, развитие, самостоятельность, телефонные переговоры",,https://hh.ru/vacancy/134756676
