vacancy_id,vacancy_name,role_group,employer_name,area,experience,schedule,salary_from,salary_to,salary_currency,hard_skills,soft_skills,tools,vacancy_url
124584669,"Руководитель экспортного отдела продаж (FMCG, Дальнее зарубежье)",Sales (общее),СОДЖ,Санкт-Петербург,Более 6 лет,"На месте работодателя, Удалённо",,,RUB,"b2b продажи, активные продажи, аудит, вэд, дебиторская задолженность, переговоры, работа с ключевыми клиентами, таможенное оформление, упаковка","контроль, организация, ответственность, планирование, развитие, системное мышление","telegram, whatsapp",https://hh.ru/vacancy/124584669
134176170,Коммерческий директор (CCO),Прочее,Realweb,Москва,От 3 до 6 лет,"Удалённо, Гибрид",,,RUB,"выполнение плана, высшее образование, командировки, развитие бизнеса","лидерство, мотивация, наставничество, нетворкинг, ориентация на результат, ответственность, планирование, развитие, сервис, управление командой",,https://hh.ru/vacancy/134176170
129862580,Директор по маркетингу (Chief Marketing Officer),Прочее,Comrade Web Agency,Москва,Более 6 лет,Удалённо,200000.0,,RUB,"b2b продажи, отчётность","лидерство, нацеленность на результат, планирование, профессиональный рост, развитие, руководство",,https://hh.ru/vacancy/129862580
134212592,Country Manager (Kazakhstan) / Руководитель представительства,Прочее,DIGITCORE,Астана,Более 6 лет,Удалённо,,,RUB,"account management, key account management, shell, комплаенс, тендеры",переговоры,,https://hh.ru/vacancy/134212592
134349723,Финансовый аналитик,Прочее,Angelico Ventures,Москва,От 1 года до 3 лет,Удалённо,,500000.0,RUB,"презентации, холодные продажи","взаимодействие, инициативность",,https://hh.ru/vacancy/134349723
134809506,Менеджер по продажам / Специалист по продажам,Sales (общее),Сервизория,Краснодар,От 3 до 6 лет,Удалённо,70000.0,200000.0,RUB,"account management, b2b продажи, key account management, saas, активные продажи, выполнение плана, выявление потребностей, заключение договоров, командировки, коммерческое предложение, контроль качества, план продаж, презентации, проведение переговоров, тендеры, тёплые продажи, холодные продажи, цикл сделки","инициативность, контроль, нацеленность на результат, переговоры, проактивность, развитие, самостоятельность, сервис",,https://hh.ru/vacancy/134809506
134809507,Менеджер по продажам / Специалист по продажам,Sales (общее),Сервизория,Ростов-на-Дону,От 3 до 6 лет,Удалённо,70000.0,200000.0,RUB,"account management, b2b продажи, key account management, saas, активные продажи, выполнение плана, выявление потребностей, заключение договоров, командировки, коммерческое предложение, контроль качества, план продаж, презентации, проведение переговоров, тендеры, тёплые продажи, холодные продажи, цикл сделки","инициативность, контроль, нацеленность на результат, переговоры, проактивность, развитие, самостоятельность, сервис",,https://hh.ru/vacancy/134809507
134800990,Руководитель проектов консалтинга / Коммерческий директор (недвижимость),Прочее,Этажи Девелопмент,Тюмень,От 3 до 6 лет,"На месте работодателя, Удалённо, Гибрид",250000.0,,RUB,"аудит, переговоры","аналитическое мышление, взаимодействие, инициативность, контроль, организация, планирование, принятие решений, развитие, стратегическое мышление, управление командой",,https://hh.ru/vacancy/134800990
134100510,Маркетолог-лидогенератор в отдел новостроек,Прочее,Apple Real Estate,Москва,От 1 года до 3 лет,"Удалённо, Гибрид",100000.0,150000.0,RUB,"воронка продаж, лидогенерация, разметка","аналитическое мышление, взаимодействие, обратная связь, самостоятельность",telegram,https://hh.ru/vacancy/134100510
133748265,Директор по маркетингу / CMO (fast-scaling AdTech &amp; Performance Marketing),Прочее,Digital marketing компания на стыке AdTech и performance marketing,Москва,Более 6 лет,Удалённо,,,RUB,"go, pipeline, saas","взаимодействие, видение, кросс-функциональное взаимодействие, лидерство, ответственность, принятие решений, публичные выступления, развитие",,https://hh.ru/vacancy/133748265
134734433,Менеджер по продажам / Специалист по продажам,Sales (общее),Сервизория,Самара,От 3 до 6 лет,Удалённо,70000.0,200000.0,RUB,"account management, b2b продажи, key account management, saas, активные продажи, выполнение плана, выявление потребностей, заключение договоров, командировки, коммерческое предложение, контроль качества, план продаж, презентации, проведение переговоров, тендеры, тёплые продажи, холодные продажи, цикл сделки","инициативность, контроль, нацеленность на результат, переговоры, проактивность, развитие, самостоятельность, сервис",,https://hh.ru/vacancy/134734433
134734434,Менеджер по продажам / Специалист по продажам,Sales (общее),Сервизория,Екатеринбург,От 3 до 6 лет,Удалённо,70000.0,200000.0,RUB,"account management, b2b продажи, key account management, saas, активные продажи, выполнение плана, выявление потребностей, заключение договоров, командировки, коммерческое предложение, контроль качества, план продаж, презентации, проведение переговоров, тендеры, тёплые продажи, холодные продажи, цикл сделки","инициативность, контроль, нацеленность на результат, переговоры, проактивность, развитие, самостоятельность, сервис",,https://hh.ru/vacancy/134734434
134647451,Менеджер по продажам,Sales (общее),Алатойс,Краснодар,От 1 года до 3 лет,Удалённо,70000.0,,RUB,"b2b продажи, активные продажи, подарки, холодные продажи","переговоры, развитие",,https://hh.ru/vacancy/134647451
134584241,Директор/руководитель проекта поставок фасадных систем,Прочее,АМТ Алекса,Москва,От 3 до 6 лет,"Удалённо, Гибрид",,,RUB,"госзакупки, тендеры",,,https://hh.ru/vacancy/134584241
134744797,"Проектный KAM по продажам НКУ (B2B, проектные продажи, электротехника) / Project Key Account Manager",KAM,"Провенто, ГК",Уфа,От 1 года до 3 лет,"На месте работодателя, Удалённо, Гибрид, Разъездной",200000.0,260000.0,RUB,"b2b продажи, баланс, выполнение плана, заключение договоров, командировки, коммерческое предложение, коммутация, комплектация, отчётность, план продаж, сертификация, цикл сделки","активность, надёжность, наставничество, обратная связь, ответственность, переговоры, развитие",,https://hh.ru/vacancy/134744797
133955827,"Sales Manager (B2B, Forex)",Sales (общее),FX Back Office,Москва,От 3 до 6 лет,Удалённо,,,RUB,"account management, b2b продажи, business development, inbound, outbound, выполнение плана, корпоративные продажи, лидогенерация, план продаж, презентации, презентация продукта, холодные продажи","взаимодействие, инициативность, нетворкинг, ориентация на результат",,https://hh.ru/vacancy/133955827
134671123,Менеджер по продажам B2B,Sales (общее),Qugo,Москва,От 3 до 6 лет,"На месте работодателя, Удалённо, Гибрид",,,RUB,"воронка продаж, перевыполнение плана","взаимодействие, нетворкинг, ответственность, принятие решений, руководство",,https://hh.ru/vacancy/134671123
134265778,Менеджер по продажам B2B,Sales (общее),Технологии Электронной Торговли,Санкт-Петербург,От 1 года до 3 лет,"На месте работодателя, Удалённо, Гибрид",150000.0,,RUB,"отели, средний чек, упаковка, хозяйственные товары",,,https://hh.ru/vacancy/134265778
134182917,Менеджер по продажам B2B,Sales (общее),МОНЕТА,Санкт-Петербург,От 1 года до 3 лет,Удалённо,150000.0,,RUB,"b2b продажи, spin, активные продажи, воронка продаж, выявление потребностей, командировки, коммерческое предложение, корпоративы, подарки, презентации, холодные продажи","организация, ориентация на результат, переговоры, развитие, сервис, телефонные переговоры",,https://hh.ru/vacancy/134182917
133963673,Менеджер по продажам B2B,Sales (общее),ГОСКРЕП,Санкт-Петербург,От 1 года до 3 лет,Удалённо,,,RUB,"b2b продажи, активные продажи, ведение клиентов, выполнение плана, дебиторская задолженность, документооборот, заключение договоров, коммерческое предложение, план продаж","активность, контроль, многозадачность, надёжность, настойчивость, нацеленность на результат, переговоры, развитие, сервис, телефонные переговоры","1с, битрикс24",https://hh.ru/vacancy/133963673
134266121,Менеджер по продажам B2B SaaS,Enterprise/SaaS Sales,ОКНА-НОВА,Пермь,От 1 года до 3 лет,Удалённо,30000.0,150000.0,RUB,"b2b продажи, saas, активные продажи, выявление потребностей, презентации, работа с возражениями, холодные звонки, холодные продажи, цикл сделки","грамотная речь, деловое общение, переговоры, сервис, телефонные переговоры","amocrm, bitrix24",https://hh.ru/vacancy/134266121
134754326,Менеджер по запуску новых продуктов (WB/Ozon),Прочее,Абрамова София Захаровна,Москва,От 1 года до 3 лет,Удалённо,,,RUB,"ведение переговоров, коммерческое предложение, комплектация, мониторинг, переговоры, переговоры с поставщиками, поиск поставщиков, расчёт стоимости, упаковка","аналитическое мышление, взаимодействие, контроль, мотивация, профессиональный рост, развитие, сервис",excel,https://hh.ru/vacancy/134754326
134833035,Complience manager (remote),Прочее,Elevate Futura,Алматы,От 1 года до 3 лет,Удалённо,,,RUB,"аудит, комплаенс, мониторинг",развитие,,https://hh.ru/vacancy/134833035
134760403,Менеджер по работе с производствами,Прочее,Marmelad lady (ИП Володось Елена Алексеевна),Бишкек,От 1 года до 3 лет,"Удалённо, Разъездной",80000.0,,RUB,"выполнение плана, контроль качества","взаимодействие, контроль, наставничество, организация, руководство",1с,https://hh.ru/vacancy/134760403
133100200,Младший менеджер проектов в стрим стратегической аналитики,Прочее,Яндекс Крауд,Санкт-Петербург,От 1 года до 3 лет,Удалённо,55000.0,,RUB,"android, ios, macos, python, sql, отчётность","презентации, развитие","excel, powerpoint, tableau",https://hh.ru/vacancy/133100200
133100199,Младший менеджер проектов в стрим стратегической аналитики,Прочее,Яндекс Крауд,Москва,От 1 года до 3 лет,Удалённо,55000.0,,RUB,"android, ios, macos, python, sql, отчётность","презентации, развитие","excel, powerpoint, tableau",https://hh.ru/vacancy/133100199
134843595,Senior DevOps/SRE-инженер,Прочее,СТБ-Студио,Москва,Более 6 лет,Удалённо,350000.0,450000.0,RUB,"backup, ci/cd, docker, kubernetes, linux, nginx, postgresql, redis, администрирование серверов, алертинг, маршрутизация, мониторинг, реорганизация","взаимодействие, надёжность, ответственность, планирование, развитие, сервис",,https://hh.ru/vacancy/134843595
134700546,"Fullstack Engineer (Node.js, React)",Прочее,Sigli,Ташкент,Более 6 лет,Удалённо,,,RUB,"azure, graphql, javascript, microsoft azure, next.js, react, solid, terraform, typescript",,,https://hh.ru/vacancy/134700546
134663485,Payments &amp; Partnerships Specialist (High-Risk PSP),Прочее,Инфотех,Санкт-Петербург,От 1 года до 3 лет,"На месте работодателя, Удалённо, Гибрид",2000.0,,USD,"go, pipeline, ведение переговоров, маршрутизация, мониторинг, отчётность","внимательность, внимательность к деталям, контроль, мотивация, ответственность, переговоры, презентации, сервис",asana,https://hh.ru/vacancy/134663485
132759015,Performance Analyst / Инженер нагрузочного тестирования,Прочее,Водород,Минск,От 3 до 6 лет,Удалённо,,,RUB,"bash, ci/cd, grafana, java, jenkins, oracle, postgresql, powershell, sql, мониторинг, подарки","взаимодействие, надёжность, обучаемость, ответственность, проактивность, тайм-менеджмент",wireshark,https://hh.ru/vacancy/132759015
134778430,Project Manager (мобильная разработка),Прочее,Премиум Кеа Груп,Москва,От 3 до 6 лет,Удалённо,150000.0,,RUB,"android, confluence, dart, firebase, ios, jira, подарки, сборка","взаимодействие, внимательность, внимательность к деталям, контроль, мотивация, наставничество, планирование, приоритизация, профессиональный рост, развитие, решение проблем, самостоятельность, управление командой","bitrix24, trello",https://hh.ru/vacancy/134778430
133968627,C# Backend Developer,Прочее,Чиббис,Москва,От 3 до 6 лет,Удалённо,,,RUB,"ci/cd, gitlab, grafana, kubernetes, mongodb, postgresql, prometheus, rabbitmq, redis, sql, микросервисная архитектура, мониторинг","адаптивность, взаимодействие, гибкость, командная работа, развитие, сервис",,https://hh.ru/vacancy/133968627
134249018,PPC manager,Прочее,DASM Group of companies (MEGA DEVELOPMENT),Алматы,От 1 года до 3 лет,"На месте работодателя, Удалённо",,,RUB,"аудит, аукционы, разметка","аналитическое мышление, внимательность, внимательность к деталям, ориентация на результат","excel, google sheets, powerpoint",https://hh.ru/vacancy/134249018
134604614,Product Manager,Прочее,Константа,Нижний Новгород,От 3 до 6 лет,"На месте работодателя, Удалённо, Гибрид",200000.0,250000.0,RUB,упаковка,"гибкость, коммуникабельность, контроль, наставничество, организация, переговоры, презентации, решение проблем, сервис",,https://hh.ru/vacancy/134604614
134656083,Acquisition Manager,Прочее,Affilyx (ООО Здоровье Онлайн),Санкт-Петербург,От 1 года до 3 лет,Удалённо,,,RUB,посадки,сервис,,https://hh.ru/vacancy/134656083
134258776,Fullstack Developer (ClickReady),Прочее,Интерактивное агентство Это Легко,Москва,От 3 до 6 лет,Удалённо,,,RUB,"claude, clickhouse, code review, cursor, java, llm, react","внимательность, мотивация, ответственность, самостоятельность",,https://hh.ru/vacancy/134258776
134251279,Influence Manager,Прочее,SAIDIteam,Москва,От 1 года до 3 лет,Удалённо,,2500.0,USD,,"аналитическое мышление, внимательность, внимательность к деталям, деловая переписка, многозадачность, переговоры, планирование, профессиональный рост","excel, google docs, google sheets",https://hh.ru/vacancy/134251279
134088166,Senior Java Developer,Прочее,Specific-Group,Минск,Более 6 лет,Удалённо,,,RUB,"claude, elasticsearch, embeddings, enterprise, java, kubernetes, llm, mongodb, postgresql, rest, snowflake, solid, spring, spring boot",,,https://hh.ru/vacancy/134088166
133946522,Product manager,Прочее,Рэд,Москва,От 1 года до 3 лет,Удалённо,130000.0,180000.0,RUB,перевыполнение плана,"аналитическое мышление, мотивация, ответственность, сервис",,https://hh.ru/vacancy/133946522
134134819,Senior Product Manager,Прочее,Ayo Support Solutions,Армения,Более 6 лет,Удалённо,,,RUB,"mvp, баланс, контроль качества, мониторинг","взаимодействие, видение, контроль, лидерство, ответственность, принятие решений, приоритизация, развитие, руководство, сервис",,https://hh.ru/vacancy/134134819
134781208,Sales Development Representative,Sales (общее),Aviasales.ru,Москва,От 1 года до 3 лет,Удалённо,,,RUB,"outbound, pipeline","принятие решений, самостоятельность","clay, lemlist, linkedin sales navigator, pipedrive, sales navigator",https://hh.ru/vacancy/134781208
134472789,Senior Front-end Developer (Research &amp; Development),Прочее,5 LAB(ФАЙВ ЛАБ),Алматы,Более 6 лет,Удалённо,,,RUB,"amazon web services, angular, aws, ci/cd, confluence, git, gitlab, gitlab ci, grpc, javascript, jira, react, rest, rest api, security, typescript, vue, vuejs, webpack",,access,https://hh.ru/vacancy/134472789
134063776,Business Development Manager (Fintech),BDM,JQT Marketing,Мексика,От 1 года до 3 лет,Удалённо,2000.0,10000.0,USD,"business development, lead generation",,,https://hh.ru/vacancy/134063776
133965333,Senior Frontend Developer (WEB),Прочее,Коде Лаб,Минск,Более 6 лет,"Удалённо, Гибрид",,,RUB,"docker, javascript, nuxt, postman, rest, solid, swagger, typescript, vue",,,https://hh.ru/vacancy/133965333
134660800,Country Manager (LATAM),Прочее,Global Trads,Москва,От 1 года до 3 лет,Удалённо,1300.0,,USD,отчётность,"взаимодействие, контроль, ответственность, переговоры, развитие, руководство","excel, google sheets",https://hh.ru/vacancy/134660800
134258434,Junior Tech manager,Прочее,Интерактивное агентство Это Легко,Москва,От 1 года до 3 лет,Удалённо,400.0,800.0,USD,"code review, git, linux, mysql, postgresql, python, sql, правка","контроль, ответственность, приоритизация, руководство",,https://hh.ru/vacancy/134258434
133350173,Senior Product Manager,Прочее,Travelata.ru (ООО Травелата),Москва,Более 6 лет,Удалённо,,,RUB,,"взаимодействие, развитие, системное мышление",,https://hh.ru/vacancy/133350173
134096831,Project Manager (Interactive Department),Прочее,MARTA,Москва,От 1 года до 3 лет,Удалённо,130000.0,,RUB,"jira, акты, документооборот, заключение договоров, коммерческое предложение, отчётность, проектная документация","взаимодействие, контроль, обратная связь, организация, ответственность, планирование, презентации, развитие, самостоятельность","asana, clickup, notion",https://hh.ru/vacancy/134096831
134858376,Content Manager / Контент - менеджер,Прочее,Шлыков Станислав Игоревич,Москва,От 1 года до 3 лет,Удалённо,55000.0,85000.0,RUB,"claude, баланс","взаимодействие, гибкость, инициативность, контроль, наставничество, ответственность, профессиональный рост, пунктуальность, развитие, сервис, стрессоустойчивость",chatgpt,https://hh.ru/vacancy/134858376
134657473,SMM-специалист / SMM Manager,Прочее,Гребенюк Михаил Сергеевич,Москва,От 1 года до 3 лет,Удалённо,80000.0,,RUB,"claude, монтаж","наставничество, ориентация на результат, развитие, саморазвитие",premiere pro,https://hh.ru/vacancy/134657473
134479553,C# (.NET) Developer (Middle+ / Senior),Прочее,IndigoSoft,Новосибирск,От 3 до 6 лет,Удалённо,2750.0,3500.0,USD,"ci/cd, code review, fastapi, gitlab, multithreading, postgresql, sql, распределённые системы","ответственность, сервис",,https://hh.ru/vacancy/134479553
