vacancy_id,vacancy_name,role_group,employer_name,area,experience,schedule,salary_from,salary_to,salary_currency,hard_skills,soft_skills,tools,vacancy_url
134858343,Менеджер по продажам,Sales (общее),Роботекс-Вологда,Москва,От 1 года до 3 лет,Удалённо,50000.0,100000.0,RUB,"активные продажи, выявление потребностей, дополнительное образование, кросс-продажи, тёплые продажи, холодные продажи","взаимодействие, наставничество, переговоры, принятие решений, работа с клиентами, развитие, телефонные переговоры",,https://hh.ru/vacancy/134858343
133964213,Менеджер отдела продаж,Sales (общее),Comfort Group,Севастополь,От 3 до 6 лет,"На месте работодателя, Удалённо, Гибрид",100000.0,,RUB,"активные продажи, заключение договоров, корпоративы, презентации, проведение переговоров, тёплые продажи, холодные продажи","аналитическое мышление, деловое общение, переговоры, развитие, телефонные переговоры",битрикс24,https://hh.ru/vacancy/133964213
133063539,Менеджер по продажам,Sales (общее),МетронЭкс,Москва,Более 6 лет,"На месте работодателя, Удалённо, Гибрид, Разъездной",150000.0,,RUB,"активные продажи, водоснабжение, выполнение плана, заключение договоров, отопление","переговоры, планирование, телефонные переговоры",,https://hh.ru/vacancy/133063539
134605051,Менеджер по продажам,Sales (общее),Галкин Евгений Валерьевич,Москва,От 1 года до 3 лет,Удалённо,100000.0,300000.0,RUB,"b2b продажи, активные продажи, ведение клиентов, заключение договоров, коммерческое предложение, презентации, проведение переговоров, сопровождение клиентов","ориентация на результат, переговоры, телефонные переговоры",,https://hh.ru/vacancy/134605051
134767385,Менеджер по работе с рекламодателями (Account Manager / Sales Manager),Account Manager,СМИ#1 (ИП Чепенко Никита Александрович),Москва,От 1 года до 3 лет,Удалённо,80000.0,,RUB,"документооборот, коммерческое предложение, маркировка, сопровождение клиентов","взаимодействие, мотивация, переговоры","amocrm, telegram",https://hh.ru/vacancy/134767385
134483367,Менеджер по продажам,Sales (общее),Дронакс,Москва,От 1 года до 3 лет,"Удалённо, Гибрид",100000.0,300000.0,RUB,"ведение клиентов, ведение переговоров, воронка продаж, заключение договоров, коммерческое предложение, отгрузка товара, переговоры","инициативность, контроль, ответственность","1с, excel, ms office",https://hh.ru/vacancy/134483367
134483368,Менеджер по продажам,Sales (общее),Дронакс,Санкт-Петербург,От 1 года до 3 лет,"Удалённо, Гибрид",100000.0,300000.0,RUB,"ведение клиентов, ведение переговоров, воронка продаж, заключение договоров, коммерческое предложение, отгрузка товара, переговоры","инициативность, контроль, ответственность","1с, excel, ms office",https://hh.ru/vacancy/134483368
134787688,Менеджер по продажам,Sales (общее),Раздоров и Компания,Алматы,От 1 года до 3 лет,Удалённо,50000.0,100000.0,RUB,"b2b продажи, активные продажи, банкротство, выявление потребностей, заключение договоров, коммерческое предложение, работа с ключевыми клиентами","деловая переписка, деловое общение, коммуникабельность, мотивация, организация, переговоры, планирование, презентации, развитие, системное мышление, телефонные переговоры",,https://hh.ru/vacancy/134787688
134482656,Менеджер по продажам,Sales (общее),Вау Сервис,Калининград,От 1 года до 3 лет,Удалённо,80000.0,120000.0,RUB,"spin, активные продажи, коммерческое предложение, отели","деловое общение, мотивация, переговоры, презентации, телефонные переговоры","chatgpt, excel, google sheets, битрикс24",https://hh.ru/vacancy/134482656
134482751,Менеджер по продажам,Sales (общее),Кадочников Егор Сергеевич,Ярославль,От 1 года до 3 лет,Удалённо,80000.0,120000.0,RUB,"выполнение плана, тёплые продажи","активность, переговоры, телефонные переговоры",,https://hh.ru/vacancy/134482751
134654224,Менеджер по продажам,Sales (общее),ANASTASIA LEPESHKO,Тбилиси,От 1 года до 3 лет,Удалённо,850.0,2000.0,USD,"активные продажи, ведение переговоров, воронка продаж, выполнение плана, отчётность, переговоры, план продаж, работа с возражениями","быстрая обучаемость, обучаемость, ориентация на результат, работа с клиентами",zoom,https://hh.ru/vacancy/134654224
134654832,Менеджер по продажам,Sales (общее),Горох Наталья Леонидовна,Сербия,От 1 года до 3 лет,Удалённо,1500.0,2500.0,USD,"активные продажи, презентации, работа с возражениями, сопровождение клиентов","грамотная речь, ориентация на результат, развитие, умение слушать",zoom,https://hh.ru/vacancy/134654832
134654527,Менеджер по продажам,Sales (общее),Атлант-право,Москва,Нет опыта,"На месте работодателя, Удалённо",83000.0,170000.0,RUB,"активные продажи, ведение переговоров, заключение договоров, презентации","грамотная речь, переговоры, сервис, телефонные переговоры",ms office,https://hh.ru/vacancy/134654527
134480896,Менеджер по продажам,Sales (общее),Техоборонэксперт,Москва,От 1 года до 3 лет,Удалённо,80000.0,,RUB,отчётность,"гибкость, инициативность, мотивация, нетворкинг, работа с клиентами, развитие",,https://hh.ru/vacancy/134480896
127170079,Менеджер по продажам,Sales (общее),Онлайн-школа Тетрика,Челябинск,От 1 года до 3 лет,Удалённо,75000.0,100000.0,RUB,"b2c продажи, активные продажи","мотивация, нацеленность на результат, профессиональный рост, развитие",,https://hh.ru/vacancy/127170079
121345657,Менеджер по продажам,Sales (общее),Онлайн-школа Тетрика,Пермь,От 1 года до 3 лет,Удалённо,75000.0,100000.0,RUB,"b2c продажи, активные продажи, презентации","клиентоориентированность, мотивация, нацеленность на результат, профессиональный рост, развитие",,https://hh.ru/vacancy/121345657
134785055,Менеджер по продажам,Sales (общее),MERLION,Санкт-Петербург,Нет опыта,Удалённо,60000.0,,RUB,"корпоративные продажи, отели, подарки, сопровождение клиентов","грамотная речь, контроль, работа с клиентами, развитие",,https://hh.ru/vacancy/134785055
133958100,Менеджер по продажам,Sales (общее),Owncode Brand,Нижний Новгород,От 1 года до 3 лет,Удалённо,70000.0,,RUB,"активные продажи, воронка продаж, выявление потребностей, допродажи, работа с возражениями",,"amocrm, telegram, whatsapp",https://hh.ru/vacancy/133958100
134601394,Менеджер по продажам,Sales (общее),Логика,Санкт-Петербург,Нет опыта,Удалённо,500000.0,,RUB,"активные продажи, документооборот","переговоры, презентации, телефонные переговоры",amocrm,https://hh.ru/vacancy/134601394
134784732,Менеджер по продажам,Sales (общее),MERLION,Волгоград,Нет опыта,Удалённо,60000.0,,RUB,"корпоративные продажи, отели, подарки, сопровождение клиентов","грамотная речь, контроль, работа с клиентами, развитие",,https://hh.ru/vacancy/134784732
134857515,Менеджер по продажам,Sales (общее),Райтер Павел,Барнаул,От 1 года до 3 лет,Удалённо,60000.0,90000.0,RUB,"b2b продажи, saas, активные продажи, воронка продаж, выполнение плана, выявление потребностей, заключение договоров, лидогенерация, мониторинг, работа с возражениями, тёплые продажи, холодные продажи","активность, внимательность, внимательность к деталям, гибкость, деловое общение, коммуникабельность, настойчивость, переговоры, планирование, сервис, стрессоустойчивость, телефонные переговоры, умение слушать","google docs, telegram, zoom, битрикс24",https://hh.ru/vacancy/134857515
134784560,Менеджер по продажам,Sales (общее),Трактордеталь,Москва,От 1 года до 3 лет,Удалённо,80000.0,150000.0,RUB,"активные продажи, корпоративы, подарки","многозадачность, переговоры, телефонные переговоры",,https://hh.ru/vacancy/134784560
134254494,Координатор партнёрских продаж/Partner Sales Coordinator (Москва),Sales (общее),Софт Плюс,Москва,От 1 года до 3 лет,Удалённо,,,RUB,"account management, b2b sales, b2b продажи, enterprise, pipeline, security","внимательность, внимательность к деталям, деловая переписка, деловое общение, контроль, ответственность, переговоры, презентации, проактивность","amocrm, bitrix24, hubspot, salesforce",https://hh.ru/vacancy/134254494
134451104,Руководитель проектов в IT / Enterprise,Enterprise/SaaS Sales,Джи Ди,Нижний Новгород,От 3 до 6 лет,"На месте работодателя, Удалённо, Гибрид",180000.0,250000.0,RUB,"enterprise, jira, акты, документооборот, командировки, комплаенс, переговоры, путевые листы, развитие клиентов, сертификация","взаимодействие, деловая переписка, контроль, лидерство, обратная связь, ответственность, презентации, приоритизация, работа с клиентами, развитие, руководство, самостоятельность, сервис, управление командой","1с, asana, figma",https://hh.ru/vacancy/134451104
134121806,Sales Manager,Sales (общее),Бануба Девелопмент,Минск,От 3 до 6 лет,"На месте работодателя, Удалённо, Гибрид",,,RUB,"b2b продажи, business development, enterprise, inbound, outbound, pipeline, активные продажи, воронка продаж, прогнозирование продаж, работа с возражениями",планирование,,https://hh.ru/vacancy/134121806
134834850,Sales manager,Sales (общее),Ахметшин Артур Раянович,Москва,От 1 года до 3 лет,Удалённо,3000.0,7000.0,USD,"enterprise, saas, отчётность","мотивация, ориентация на результат, проактивность",,https://hh.ru/vacancy/134834850
134531517,Менеджер по продажам программы лояльности | Enterprise клиенты | Edtech,Enterprise/SaaS Sales,HR.Vision,Москва,От 1 года до 3 лет,Удалённо,250000.0,300000.0,RUB,"документооборот, отпускные, отчётность",развитие,,https://hh.ru/vacancy/134531517
134711088,Менеджер по продажам B2B Enterprise / Привлечению ключевых клиентов,KAM,РИЛСМАРКЕТ,Москва,От 1 года до 3 лет,Удалённо,120000.0,400000.0,RUB,"b2b продажи, enterprise, активные продажи, переговоры, презентации, цикл сделки","настойчивость, ответственность, самостоятельность",,https://hh.ru/vacancy/134711088
133500881,Ведущий менеджер по продажам,Sales (общее),ИНТЕРВОЛГА,Москва,От 3 до 6 лет,Удалённо,,,RUB,"b2b продажи, enterprise, php, react, vue, активные продажи, анализ воронки, воронка продаж, выполнение плана, коммерческое предложение, переговоры, представительские расходы, презентации, проведение переговоров, прогнозирование продаж, цикл сделки","мотивация, планирование, работа с клиентами, развитие","1с, 1с:предприятие, bitrix24, битрикс24",https://hh.ru/vacancy/133500881
133104855,Менеджер проектных продаж (1С-Битрикс:Enterprise),Enterprise/SaaS Sales,ГЭНДАЛЬФ,Ростов-на-Дону,От 1 года до 3 лет,"На месте работодателя, Удалённо, Гибрид",110000.0,,RUB,"b2b продажи, it продажи, активные продажи, выявление потребностей, заключение договоров","деловая переписка, деловое общение, многозадачность, переговоры, развитие, телефонные переговоры",1с,https://hh.ru/vacancy/133104855
133972141,Senior Franchise Sales Manager (Europe),Sales (общее),Академ Интеллект,Москва,От 3 до 6 лет,Удалённо,2500.0,,USD,"b2b sales, enterprise, inbound, lead generation",,,https://hh.ru/vacancy/133972141
133895839,Ведущий менеджер по продажам (ИБ),Sales (общее),ScanFactory,Москва,От 3 до 6 лет,Удалённо,,,RUB,"b2b продажи, enterprise, активные продажи, ведение переговоров, заключение контрактов, информационная безопасность, отчётность, переговоры, презентация продукта, проведение переговоров","активность, взаимодействие, нацеленность на результат, организация, презентации",,https://hh.ru/vacancy/133895839
134725013,Корпоративный архитектор бизнес-систем / Enterprise Business Architect,Enterprise/SaaS Sales,VVP Group,Москва,От 3 до 6 лет,"На месте работодателя, Удалённо, Гибрид",,,RUB,"clickhouse, enterprise, документооборот","взаимодействие, внимательность, внимательность к деталям, сервис, системное мышление",1с,https://hh.ru/vacancy/134725013
133905494,"Супервайзер, Карши",Прочее,DAMIRA BEVERAGES ENTERPRISE,Карши,От 1 года до 3 лет,Удалённо,,,RUB,"enterprise, выполнение плана, заключение договоров, контроль поставок, мерчандайзинг, мониторинг, отчётность, план продаж, презентации, проведение переговоров, хранение","взаимодействие, дисциплинированность, контроль, многозадачность, мотивация, наставничество, организация, ответственность, переговоры, работа с клиентами, развитие, руководство, стрессоустойчивость, управление командой","excel, powerpoint, word",https://hh.ru/vacancy/133905494
133904733,"Супервайзер, Ургенч",Прочее,DAMIRA BEVERAGES ENTERPRISE,Ургенч,От 1 года до 3 лет,Удалённо,,,RUB,"enterprise, выполнение плана, заключение договоров, контроль поставок, мерчандайзинг, мониторинг, отчётность, план продаж, презентации, проведение переговоров, хранение","взаимодействие, дисциплинированность, контроль, многозадачность, мотивация, наставничество, организация, ответственность, переговоры, работа с клиентами, развитие, руководство, стрессоустойчивость, управление командой","excel, powerpoint, word",https://hh.ru/vacancy/133904733
133904925,"Супервайзер, Наманган",Прочее,DAMIRA BEVERAGES ENTERPRISE,Андижан,От 1 года до 3 лет,"Удалённо, Разъездной",,,RUB,"enterprise, выполнение плана, заключение договоров, контроль поставок, мерчандайзинг, мониторинг, отчётность, план продаж, презентации, проведение переговоров, хранение","взаимодействие, дисциплинированность, контроль, многозадачность, мотивация, наставничество, организация, ответственность, переговоры, работа с клиентами, развитие, руководство, стрессоустойчивость, управление командой","excel, powerpoint, word",https://hh.ru/vacancy/133904925
133904926,"Супервайзер, Наманган",Прочее,DAMIRA BEVERAGES ENTERPRISE,Наманган,От 1 года до 3 лет,"Удалённо, Разъездной",,,RUB,"enterprise, выполнение плана, заключение договоров, контроль поставок, мерчандайзинг, мониторинг, отчётность, план продаж, презентации, проведение переговоров, хранение","взаимодействие, дисциплинированность, контроль, многозадачность, мотивация, наставничество, организация, ответственность, переговоры, работа с клиентами, развитие, руководство, стрессоустойчивость, управление командой","excel, powerpoint, word",https://hh.ru/vacancy/133904926
133904206,Супервайзер (Джизак),Прочее,DAMIRA BEVERAGES ENTERPRISE,Джизак,От 1 года до 3 лет,Удалённо,,,RUB,"enterprise, выполнение плана, заключение договоров, контроль поставок, мерчандайзинг, мониторинг, отчётность, план продаж, презентации, проведение переговоров, хранение","взаимодействие, дисциплинированность, контроль, многозадачность, мотивация, наставничество, организация, ответственность, переговоры, работа с клиентами, развитие, руководство, стрессоустойчивость, управление командой","excel, powerpoint, word",https://hh.ru/vacancy/133904206
133904207,Супервайзер (Джизак),Прочее,DAMIRA BEVERAGES ENTERPRISE,Гулистан,От 1 года до 3 лет,Удалённо,,,RUB,"enterprise, выполнение плана, заключение договоров, контроль поставок, мерчандайзинг, мониторинг, отчётность, план продаж, презентации, проведение переговоров, хранение","взаимодействие, дисциплинированность, контроль, многозадачность, мотивация, наставничество, организация, ответственность, переговоры, работа с клиентами, развитие, руководство, стрессоустойчивость, управление командой","excel, powerpoint, word",https://hh.ru/vacancy/133904207
130593604,Менеджер по продажам (Enterprise / IT),Enterprise/SaaS Sales,Первая Форма,Москва,Более 6 лет,Удалённо,,,RUB,"enterprise, документооборот, цикл сделки","мотивация, переговоры, презентации",,https://hh.ru/vacancy/130593604
134664584,Ведущий менеджер по продажам ИТ-решений (Senior Sales Manager),Sales (общее),Open Vision,Москва,От 3 до 6 лет,"На месте работодателя, Удалённо, Гибрид",180000.0,,RUB,"223-фз, 44-фз, b2b продажи, business development, enterprise, активные продажи, ведение переговоров, виртуализация, выявление потребностей, допродажи, информационная безопасность, коммерческое предложение, кросс-продажи, переговоры, полный цикл продаж, развитие бизнеса, сертификация, средний чек","активность, гибкость, контроль, работа с клиентами, развитие, руководство",,https://hh.ru/vacancy/134664584
134438412,Менеджер по продажам B2B (Enterprise),Enterprise/SaaS Sales,ReadyOnline (ИП Максименкова Марина Сергеевна),Москва,От 1 года до 3 лет,"Удалённо, Разъездной",250000.0,,RUB,"enterprise, ведение переговоров, воронка продаж, презентации",переговоры,"bitrix24, excel, powerpoint",https://hh.ru/vacancy/134438412
132266419,"Solution Sales / Менеджер по продажам решений (ИТ, B2B, Enterprise)",Enterprise/SaaS Sales,Первая Форма,Москва,От 3 до 6 лет,Удалённо,,,RUB,"enterprise, документооборот, цикл сделки","мотивация, переговоры, презентации",,https://hh.ru/vacancy/132266419
